{"actionable":false,"apply_requires_separate_exact_authorization":true,"authorized":false,"base_commit":"9a8b3d4278b51788e49d44a651535a948ffd1685","blockers":["cloud-init-not-staged","network-isolation-not-proven","separate-exact-authorization-required"],"format":"home-lab-debian-lifecycle-vm-plan-evidence-v1","observed_at":"2026-09-03T21:14:15Z","operation":"create","plan_json_sha256":"b79e6f5a4616aca3c5b456203548d94a16c38b8984ad7e01f7ab2d6f6c4b489b","plan_sha256":"b2c18f9c3fb46ca7cf39f946e98b9439c7ec6ead394eef61e6aad476f7042ba6","provider":"bpg/proxmox@0.111.1","provider_refresh_result":"one-create-action","resource":"proxmox_virtual_environment_vm.recovery[0]","source_root":"infrastructure/tofu/proxmox-restic-recovery-qualification","state_sha256":"e3b0c44298fc1c149afbf4c8996fb92427ae41e4649b934ca495991b7852b855","version":1,"vmid":9900}
